{
  "schemaVersion": "proofline-goal-contract/1",
  "title": "Checkout cutover acceptance contract",
  "revision": "checkout-cutover-v3.2",
  "items": [
    { "id": "PAY-01", "goal": "Authorize payment retries without duplicate capture.", "acceptance": "The retry and timeout suite records zero duplicate captures across at least 1,500 cases." },
    { "id": "PERF-01", "goal": "Keep checkout responsive at launch traffic.", "acceptance": "p95 confirmation latency is at most 1,800 ms at 400 requests per second, and a 2x burst recovers within 60 seconds." },
    { "id": "OPS-01", "goal": "Rollback the cutover inside one operator window.", "acceptance": "The prior release is restored within 12 minutes with zero payment-ledger drift." }
  ]
}

