{
  "schemaVersion": "proofline-goal-contract/1",
  "title": "Offline release acceptance contract",
  "revision": "offline-release-2026.09",
  "items": [
    { "id": "WEB-01", "goal": "Support the documented desktop and mobile widths.", "acceptance": "The primary workflow has no horizontal overflow at 1440x900 and 390x844." },
    { "id": "SIGN-01", "goal": "Keep the offline package inventory inspectable.", "acceptance": "Every packaged file has a matching SHA-256 digest entry." },
    { "id": "A11Y-01", "goal": "Complete the primary workflow without pointer input.", "acceptance": "Keyboard-only traversal reaches every interactive control with a visible focus state and no trap." }
  ]
}

